{
  "meta": {
    "task_id": "TASK-20260316-6C753E",
    "message_id": "MSG-93E8FD9A",
    "version": 1,
    "from_agent": "D",
    "to_agent": "C",
    "timestamp": "2026-03-16T07:53:08.653091+00:00",
    "task_type": "complex",
    "stage": "execute",
    "status": "pending"
  },
  "payload": {
    "plan_id": "PLAN-TASK-20260316-6C753E",
    "execution_result_id": "EXEC-TASK-20260316-6C753E-1",
    "instance_id": 1,
    "completed_subtasks": [
      "ST-003",
      "ST-004"
    ],
    "result": {
      "content": "{\n  \"ST-003\": \"[尚书省-1执行结果] 分析执行：（LLM 生成的执行结果占位）\",\n  \"ST-004\": \"[尚书省-1执行结果] 结果整合：（LLM 生成的执行结果占位）\"\n}"
    },
    "unresolved_items": []
  },
  "notes": [
    "尚书省实例 1 已按计划完成分配的子任务。"
  ],
  "issues": [],
  "attachments": [
    {
      "type": "plan_reference",
      "ref_id": "PLAN-TASK-20260316-6C753E"
    }
  ]
}